,,,,,,,,,
,安本,京都市学校歴史博物館,京都府,きらめきはぐくむ 京都の学校と伝統工芸――西陣織・京友禅・京焼――,2023/9/14,2023/12/17,http://kyo-gakurehaku.jp/exhibition/R5/050914/index.html,京都市学校歴史博物館では、京都市の学校に伝わる、学校や地域にゆかりのある芸術家たちが手がけた作品や、地域の人たちから贈られた作品を管理しています。それらの中には、地域と関係が深い西陣織・京友禅・京焼など、伝統工芸の作品も含まれています。当館の開館２５周年を記念した企画展「きらめきはぐくむ 京都の学校と伝統工芸――西陣織・京友禅・京焼――」は、京都を輝かせてきた伝統工芸と学校とのつながりにあらためて注目する企画展です。京都市の学校園に伝わる伝統工芸の作品を中心に、伝統工芸にたずさわる家に生まれた画家たちによる学校への寄贈作品を展示します。あわせて、地域の伝統工芸の魅力が、学校で子どもたちへとどのように伝えられてきたかをうかがい知ることができる学校の記録なども御覧いただきます。きらめく伝統工芸が京都の学校でどのように育まれてきたのか、作品を通してみてみましょう。,"29, 210, 70, 721, 751, 753"
,安本,龍谷大学  龍谷ミュージアム,京都府,秋季特別展「みちのく いとしい仏たち」,2023/9/16,2023/11/19,https://museum.ryukoku.ac.jp/exhibition/2023/michinoku/,江戸時代、全国の寺院では、上方や江戸で造られた金色に輝く立派な仏像が、ご本尊として安置されました。一方、小さなお堂や祠、民家の仏壇や神棚などには、その土地の大工さんやお坊さんたちの手による、素朴でユニークな仏像・神像がまつられ、人々に大切に護られてきました。この展覧会では、青森・岩手・秋田の3県に伝わった約130点の仏像・神像をご紹介します。みちのくの厳しい風土の中、人々の暮らしにそっと寄り添ってきた、やさしく、いとしい仏たちの、魅力あふれる造形をご覧ください。,"17, 18, 214, 29, 71"
,安本,風俗博物館,京都府,,,,,,
,安本,京都産業大学ギャラリー,京都府,,,,,,
,安本,角屋もてなしの文化美術館,京都府,「四條派と角屋の交流展（後期）」,2023/9/15,2023/12/15,http://sumiyaho.sakura.ne.jp/page/art_museum.html#detail,四條派の祖は、松村月渓（呉春。文化8年・1811年没、享年70)といいます。初め中国の元・明の画法を慕う大西酔月（生没年不詳）に学び、後に蕪村の門に入り南画を修め、併せて俳諧の手ほどきをうけました。蕪村没後は円山応挙の門に入ろうとしたものの固辞され、親友として遇されました。応挙の写実的な作風を学び、蕪村風を転じて写生派絵師として一家をなしました。月渓は天明元年（1781）の暮れに池田（大阪府）に転居し、新春を迎えたことから、画名を呉春と改名しました。これは池田の古名を「呉服の里」と称したことにちなんだものです。いつしか呉春は、四條風と呼ばれるようになり、円山応挙が寛政7年（1795）に没した後、流派と認められていきます。四條派という名称は呉春の後継者に受け継がれ、一つの流派と認定された時点で発生したとされます。弟子の松村景文（天保14年・1843年没、享年64）や岡本豊彦（弘化2年・1845年没、享年72）など、多くが四条通の近くに住んでいたことに由来します。文政の頃（1818～30）には、円山派を凌駕するまでになります。京都では景文や豊彦の画風が世に受けられて、その後の京都画壇の中枢を占める流派として発展したのであります。ところで、角屋とのかかわりで申しますと、天明2年（1782）に発行した角屋の座敷案内書「しまはら寿見徳座敷之記」に、大座敷松の間の地袋の襖が、「月渓筆 下金地桃源の図ふすま二枚」と記されております。署名からすると、安永末年（1781）頃に依頼されたものと考えられます（月渓当時30歳前）。残念ながら松の間の絵そのものは、大正14年（1925）に焼失したことから現物は伝存しませんが、写真だけは残っております。松村景文は呉春の実弟で、角屋には25点もの花鳥画や人物画が伝来しています。中でも「恵比寿図」は下絵までも伝わり、景文との繋がりが深かったとことがわかります。そのような交流から、角屋の十代目常徳（明治3年・1870年没、享年49）は、景文の弟子磯野華堂(生没年不詳)に師事し、模写に精進しています。そのため、弘化4年（1847）発行の『皇都書画人名録』に 師とともに登載され、「画学華堂先生 同所（朱雀）中川玉洲 通称 宗三郎」と記されるほどでした。玉洲は呉春筆「休息歌仙図」巻を模写していて、その捲り1巻が現存しております。今回の初公開をお楽しみください。本展では、このような経緯から、呉春―景文―華堂―玉洲という系譜による四條派と角屋の深い交流 がうかがえることになります。平成18年以来、17年ぶりの展示であり、この機会にぜひご高覧賜りますようご案内申し上げます。,"70 , 721"
,安本,京都鉄道博物館,京都府,貨物鉄道輸送 150 年記念企画展 「モノを運ぶ鉄道展〜列車が乗せるのは人だけじゃない。〜」,2023/9/16,2023/11/26,https://www.kyotorailwaymuseum.jp/pdf/frt_150.pdf,1873(明治6)年9月 15 日に最初の貨物鉄道輸送が新橋〜横浜間で開始されてから、150 年を迎えることを 記念した企画展を開催します。これまでの貨物鉄道輸送の 150 年を振りかえり、貨物鉄道のあゆみ、梅田駅 から吹田貨物ターミナル駅への変遷を中心にご紹介します。,"215, 216, 268, 29"
,安本,ＫＣＩギャラリー,京都府,収蔵品紹介37「裾引くトレーン―19世紀後半のドレス」展,2023/9/25,2023/12/22,https://www.kci.or.jp/information/2023/09/3719_a_selection_from_kcis_collection_no_37_dress_with_train_working_title.html,19世紀後半、当時の女性たちは時間帯や場所、用途に応じて一日に何回も着分けていました。ドレスの後ろに長く引くトレーン（引き裾）は、宮廷用や結婚式用などのドレスに必要不可欠でした。本展では、ドレスを華やかに演出したトレーン付きのドレスの中から、初出展となる作品や、長らく出展していないものを中心に展示いたします。,"23, 38, 757"
,高下,醍醐寺宝聚院,京都府,,,,,,
,高下,茶道資料館,京都府,令和5年秋季特別展「裏千家十三代家元　圓能斎鉄中宗室―現代への礎―」,2023/9/26,2023/12/3,https://www.urasenke.or.jp/textc/gallery/museum/tenji/next/,"令和5年は裏千家十三代家元・圓能斎鉄中宗室（1872～1924）の百回忌にあたります。本展はこれを記念して、圓能斎の功績や、その活動を支えた人物との交流を紹介します。
　圓能斎が生きた明治・大正時代は、近代的な国家形成のために日本の様々な分野で一大変革が行われた時代でした。そのような中で家元を継いだ圓能斎は、女学校教育への茶道の導入とその指導者の育成に注力し、茶道人口の増大と発展に貢献しました。また、裏千家家元としてはじめて点前や茶道具に関する書籍を公刊し、出版による茶道普及と作法の伝承に踏み切ります。
　茶の湯教育の新たな体制を確立し、現代の裏千家茶道の礎を築いた圓能斎に関連する茶道具・茶書などを展示し、その軌跡をたどる展観とします。


",
,高下,北村美術館,京都府,"令和五年 秋季茶道具取合展 「しのぶ秋」

",2023/9/9,2023/12/3,https://www.kitamura-museum.com/,,
,高下,樂美術館,京都府,開館45周年記念「定本 樂歴代」,2023/9/2,2023/12/24,https://www.raku-yaki.or.jp/museum/exhibition/index.html,"樂歴代は、初代長次郎はじめ、それぞれの時代を生き、己の茶碗を新たに生み出してきました。それは、千利休居士の利休道歌の中に出てくる「守破離」の言葉にあるように、変わらない本質と時代変化の中で新たな作風を追求してきたと言えます。まさに「不易流行」。利休居士が求めた侘びの精神を歴代それぞれが軸に据え、今日まで450年にわたりその精神性を茶碗に込め「茶」と共に歩んで参りました。
そうした樂家の伝統と創造にかける歴代の作陶を真正面から捉え、「定本」となるべく、2013年に『定本 樂歴代』が出版されました。
それから10年。15代が隠居し直入に、16代が襲名により吉左衞門と戸籍より改名致しました。
それぞれの隠居、襲名を経て、『定本 樂歴代』も15代・16代の最新作品を増やし、歴代の印も完全網羅し、新たに改訂版を出版することとなりました。
本展では改訂新版『定本 樂歴代』掲載作品の中より、長次郎から16代吉左衞門までの代表作となる名品を中心に展観し、また初版から10年の間に考察が進んだ、樂家と外戚になる本阿弥光悦、玉水焼三代を加え、樂焼の歴史、作風の特色とその変遷を探ります。",
,高下,高麗美術館,京都府,開館三十五周年記念展覧会 秋冬展 吉祥文様と草虫−京都のなかの朝鮮美術−,2023/9/2,2023/12/10,https://www.koryomuseum.or.jp/exhibit.php,"吉祥文様は福・寿というめでたい前兆を象徴します。朝鮮半島における絵画や陶磁器、瓦や布など多様な身の回りのものには描かれた文様は、装飾のみならず、人々の願いが込められていました。
鄭詔文の友人でもあった司馬遼太郎は、朝鮮固有の美意識について、「韓国・朝鮮の文化には、朝鮮語でいうmot(멋 モッ)でつらぬかれているような気がします」と言っています。
鄭は幼い時に離れた故郷の人々の生活に根ざした美意識を求めて、高麗美術館を創設しました。秋冬展では鄭詔文コレクションから吉祥の願いが込められた平和で時々ユーモラスな朝鮮半島の美の世界をお楽しみください。",
,高下,大谷大学博物館,京都府,"大谷大学博物館開館20周年記念　2023年度特別展
宗祖親鸞聖人誕生850年・立教開宗800年記念
古典籍の魅力2023

",2023/10/10,2023/11/28,https://www.otani.ac.jp/events/2023/sfpjr700000104ia.html,開館20周年、宗祖親鸞聖人誕生850年にあたり、館蔵の国指定重要文化財10件とゆかりの作品、宗祖にかかわる重宝を中心に、弊館の役割を振り返り、未来を展望する展覧会です。国宝・重要文化財約20件を含む貴重な作品を展観予定。,
,高下,立命館大学国際平和ミュージアム,京都府,,,,https://www.ritsumeikan-wp-museum.jp/,,
,吉田,京都府京都文化博物館,京都府,もしも猫展,2023/9/23,2023/11/12,https://www.bunpaku.or.jp/,「もしも、うちの猫が人のように話したら？」そんな想像をしたことはありませんか。人間以外の何かを人間になぞらえることを擬人化とよびます。天保12年（1841）頃から、浮世絵師の歌川国芳は猫を擬人化したり、役者を猫にした作品を次々と発表していきます。本展では猫の擬人化作品と、それらを描いた歌川国芳を主軸に捉えながら、江戸時代の擬人化表現の面白さに着目します。そのなかで、なぜ国芳作品にかくも惹きつけられるのか、その魅力のありかを探っていきます。,
,吉田,京都府京都文化博物館,京都府,Kyoto Art for Tomorrow 2024-京都府新鋭選抜展-,2024/1/20,2024/2/4,https://www.bunpaku.or.jp/,新進作家による卓抜した創造性、技術を備えた作品を紹介します。,
,吉田,京都府京都文化博物館,京都府,コスチュームジュエリー 美の変革者たち シャネル、ディオール、スキャパレッリ 小瀧千佐子コレクションより,2024/2/17,2024/4/14,https://www.bunpaku.or.jp/,コスチュームジュエリーの世界的コレクターで研究家でもある小瀧千佐子氏の貴重なコレクションを通して、宝石や貴金属などの従来の素材にとらわれず自由にデザインされたコスチュームジュエリーの楽しさをご紹介します。,
,吉田,大西清右衛門美術館,京都府,,,,http://www.seiwemon-museum.com/,,
,吉田,花園大学歴史博物館,京都府,若狭の古墳―よみがえる若狭の王者たち―,2023/9/28,2023/12/23,https://www.hanazono.ac.jp/about/museum/,古代御食国として朝廷と特別な関係を有した若狭の地域は、狭小な地域でありながら数多くの前方後円墳が５世紀から６世紀ごろにかけて連綿と築かれました。そこは日本海側各 地、そして朝鮮半島の国々と大和をつなぐうえで当時もっとも重要な地域であり、そこには大和にはない特色ある文化、とくに大陸色の強い石室や副葬品が数多く認められます。墳墓に収められた数々の副葬品やそこに樹立された埴輪から、若狭の王者たちの姿を解き明かします。,
,吉田,並河靖之七宝記念館,京都府,並河靖之、その人生観 七宝と親交,2023/9/1,2023/12/17,https://namikawa-kyoto.jp/,本展覧会は、七宝家・並河靖之の七宝業を支えた人生観に、並河家に遺されてきた七宝や靖之の親交からふれていただき、並河七宝と明治の七宝業の新たな魅力をご紹介します。今日なお、世界中の人々を魅了する並河靖之の七宝業の存在が、日本国内で知られるようになったのは、2000年代入ってからに過ぎません。しかし、今から思えば明治の近代七宝業も当時は知られていない新興産業でした。靖之は、そもそも七宝や物づくりに携わる家に生まれたわけではなく、生家は近江栗太郡六地蔵梅野木の高岡家で、川越藩京都留守居役の武家でした。並河家には1855(安政2)年に数11歳で養子に入り、同家が青蓮院門跡坊官を務める家柄で、天台座主・青蓮院宮入道尊融親王(後の久邇宮朝彦親王)に仕えました。主人が被る幕末維新の境遇に自身も翻弄され、先行きへの不安が絶えずあり、靖之は朝彦親王に仕える傍ら1873(明治6)年に七宝を手掛け、1878(明治11)年に専業とします。当時、国内では幕末の尾張で開発された尾張七宝が盛んとなり産業としての将来性が期待され、京都でも関心が高まり、靖之も満を持して七宝業に飛び込みました。実業の世界で紆余曲折を経ながら、やがて自身の七宝業を究めて、珠玉の並河七宝を創出し、日本の七宝を世界に冠たるものとしました。靖之が創始した「並河七宝」は類ない耀きと高雅さを放ち、19世紀の万国博覧会を通じてその名を世界に馳せ、多くの人々を京都へと誘いました。 約五十年にわたる偉業を一代で成し得た靖之を支えたものは、新時代の生きる術として、人生を投じた七宝への熱情があったことは勿論ですが、その心情は多くの人との親しい交友によって助けられ、培われていったものです。人生の一大事に遭遇すると、心は大きく揺らぎますが、それを踏み越えて、人は誰でも考えを新たにし、新たな一歩を進めていきます。真摯に生きた靖之の人生観は、人生の折々で変わったことは想像に難くありませんが、根底には七宝への探求心と、ひと様への感謝が絶えずあったといえます。世情は落ち着かないままですが、皆様には当館にて、実りゆく季節の移ろい味わいつつ、心穏やかにお過ごしください。,
,吉田,漢検  漢字博物館・図書館,京都府,今年の漢字®展,2023/10/24,2024/2/25,https://www.kanjimuseum.kyoto/,「今年の漢字」開始当初の1995年から2022年までの大書をすべて現物で展示します。日本の世相の移り変わりを迫力の大書とともにお楽しみください。,
,吉田,霊山歴史館,京都府,桂小五郎と幾松～広戸文庫史料～,2023/9/13,2023/11/5,https://www.ryozen-museum.or.jp/,幕末や明治維新に活躍し、「維新の三傑」と呼ばれる英傑がいますが、それが木戸孝允（桂小五郎）、西郷隆盛、大久保利通です。桂は幕末、長州藩の外交や国事周旋を担当し、藩内における尊王攘夷派の指導者になりました。そんな桂も、元治元年（１８６４）７月に大きな挫折を味わいます。長州勢は「禁門の変」で敗走し、桂はしばらく京都に潜伏して情勢を探った後、但馬国出石（兵庫県豊岡市）に逃れ、約２５０日間にも及ぶ潜伏生活を送りました。桂を出石に逃がしたのは対馬藩京屋敷の出入り業者だった広戸甚助で、出石では甚助の弟・直蔵が中心になって桂を匿いました。この頃の桂は、池田屋事件や禁門の変などで様々な困難に直面し、これからの人生を商人として生きようかと思い悩み、人生のどん底を味わっていました。そこへ、のちに妻となる幾松が迎えにやってきて激励し、奮起した桂は再び政治の第一線に戻ることになりました。その後、藩の命令で姓を木戸に変えると、薩長同盟の締結や倒幕に尽力し、維新後は東京奠都、版籍奉還、廃藩置県、岩倉使節団の副使を務めるなど、明治新政府の基礎を築きました。本企画展では、２００６年の１月に出石の広戸家から霊山歴史館に寄贈された史料を中心に、桂小五郎と幾松の実像に迫ります。,
,吉田,独立行政法人  国立文化財機構 京都国立博物館,京都府,東福寺,2023/10/7,2023/12/3,https://www.kyohaku.go.jp/jp/,新緑や紅葉の名所として知られる東福寺は、京都を代表する禅寺の一つです。中世以来の巨大な建造物の数々は圧倒的なスケールを誇り、「東福寺の伽藍面」の通称で知られています。東福寺の寺宝をまとめて紹介する初の機会となる本展では、伝説の絵仏師・明兆による記念碑的大作「五百羅漢図」全幅を修理後初公開するとともに、巨大伽藍にふさわしい特大サイズの仏像や書画類も一堂に展観いたします。草創以来の東福寺の歴史を辿りつつ、大陸との交流を通して花開いた禅宗文化の全容を幅広く紹介し、東福寺の日本文化における意義とその魅力を余すところなくご覧いただきます。,
,小山,養源院,京都府,,,,,,
,小山,京都芸術大学芸術館,京都府,,,,,,
,小山,京都市動物園,京都府,青銅器になった動物たち,2023/11/3,2023/12/10,https://www5.city.kyoto.jp/zoo/event/20230915-73180.html,中国古代青銅器のモチーフとなった動物たち。園内で飼育している数種類の動物を、考古学の視点からお楽しみいただけるよう中国古代青銅器の解説パネルを設置します。,"22,756"
,小山,京都市動物園,京都府,（開園120周年記念）のすたるじー写真展,2023/8/15,2024/3/31,https://www5.city.kyoto.jp/zoo/event/20230811-72877.html,開園１２０周年を記念し、これまでの京都市動物園の歴史を、過去の写真とともにエピソードを添えて振り返ります。園内の各所に掲示しておりますので、是非ご覧ください。,"74,216"
,小山,細見美術館,京都府,挑み、求めて、美の極致―みほとけ・根来・茶の湯釜―,2023/11/14,2024/1/28,https://www.emuseum.or.jp/exhibition/next_exhi.html,記念展Ⅱでは、「挑み、求めて、美の極致－みほとけ・根来・茶の湯釜－」と題して、生涯にわたり自身の鑑識眼を鍛え、学び続けることを諦めなかった初代古香庵(細見良1901～79）が愛蔵した作品を紹介するものです。 美の原点として心酔した神道仏教美術、力強く美しい漆器・根来、研究に没頭した茶の湯釜などの金工品ほか、平安から桃山時代にかけての名品の数々をご覧いただきます。,"212,752,756"
,小山,日図デザイン博物館,京都府,,,,,,
,小山,京都国立近代美術館,京都府,京都画壇の青春―栖鳳、松園につづく新世代たち,2023/10/13,2023/12/10,https://www.momak.go.jp/Japanese/exhibitionarchive/2023/455.html,京都の明治以降の美術界の歴史は、東京や西欧との対峙の歴史と言っても過言ではありません。開館60周年を記念して開催する今展では、その中でも特に明治末～昭和初期を近代京都画壇の青春時代ととらえ、土田麦僊（1887～1936）を中心に据え、小野竹喬、榊原紫峰、岡本神草などの代表作約90点を4章に分けて展示します。まさに青春時代と重なった画家だけでなく、上村松園、菊池契月、木島桜谷といった先輩作家達や師匠の竹内栖鳳も含んで一丸となり、東京、西欧、そして京都の伝統に挑んだ彼らの、青春時代特有の過剰さと繊細さとをあわせもつ、完成期とはまた異なる魅力を放つ作品群をご堪能ください。,"215,216,721"
,小山,京都国立近代美術館,京都府,小林正和とその時代―ファイバーアート、その向こうへ,2024/1/6,2024/3/10,https://www.momak.go.jp/Japanese/exhibitionarchive/2023/456.html,小林正和（1944-2004）は京都市に生まれ、京都市立美大で漆芸を専攻するものの、より自由な色彩表現を求めて川島織物デザイン部に就職し、そこで「糸」と出会いました。一本の「糸」に内在する表現の可能性を追求した彼の作品は、伝統的なテキスタイルの枠組みを越えて「ファイバーアート」と呼ばれ、国内外で高い評価を得ることになります。本展では、この分野の重要な先駆者としての小林の活動を回顧するとともに、彼と伴走した作家たちの作品を併せて紹介することで、改めて「ファイバーアート」の過去、現在そして未来について考えます。,"216,724"
,小山,京都市京セラ美術館,京都府,嶋春香,2024/3/5,2024/6/23,https://kyotocity-kyocera.museum/exhibition/20240305-20240623,嶋春香は、人と図像との関わりをテーマに、さまざまな時代や文化の道具が写った資料写真をモチーフに作品を制作してきました。最新作では1つの絵画の中に4つの図像を重ねて描く〈Transformation〉シリーズ（2022-）のほか、自身が日々消費する牛乳パックを支持体に、記録であり絵画でもある〈蒐集〉シリーズ（2019-）を継続しています。また、〈Touch〉シリーズは、一本の筆と一色の蛍光色で濃淡をつけて対象物を描き、資料写真という実際には触れることができないイメージに対し、描くことで可能となる「Touch（触れる、関わりを持つ）」という身体的な行為を通して理解を深めようとしています。また、蛍光色の発色の強さから「見たいのに見えない」といったアンビバレントな視覚作用を起こし、平面だけではなく立体作品としても展開。歴史・文化的資料を出発点としながらも、史実を裏付ける記録としての用途や文脈を読み取るのではなく、色、形、イメージから発せられる印象や個人の想像力を通しての対象物の理解を試みます。,"20,724"
