,,,,,,,,,
,関原,兵庫陶芸美術館,兵庫県,日本工芸会陶芸部会50周年記念展 未来へつなぐ陶芸ー伝統工芸のチカラ,2023/9/9,2023/11/26,https://www.mcart.jp/exhibition/e3502/,我が国が誇る工芸技術「陶芸」は、時代とともに技法や表現が多様化し、現代まで著しく進化を遂げてきました。とりわけ昭和戦後期以降には、陶芸の創作活動が活発化し、意欲的な作品が次々と発表されています。1950年に陶芸をはじめ様々な分野の工芸技術の保存と活用を目的に、文化財保護法が施行され、その５年後の文化財保護法改定を機に「日本工芸会」が発足しました。日本工芸会は重要無形文化財保持者（いわゆる人間国宝）を中心に、各分野の伝統工芸作家や技術者らで組織され、「日本伝統工芸展」を中心に作品を発表。そして1973年には同会陶芸部会所属の作家による「第１回新作陶芸展（陶芸部会展）」が開催され、現在に至っています。,
,松田,但馬国府・国分寺館,兵庫県,豊岡の幕末・維新,2023/9/30,2024/1/16,https://www3.city.toyooka.lg.jp/kokubunjikan/html/exhibit57.html,本展は日本工芸会陶芸部会50周年を記念した展覧会であり、同会で活躍した作家の秀作とともに、その活動の歴史を振り返るものです。歴代の人間国宝の作品をはじめ、窯業地ならではの素材と伝統を受け継いだ作家らによる作品や茶の湯のうつわなど、伝統工芸の技と美を紹介します。さらに、未来を担う若手作家らの作品も見どころの一つと言えるでしょう。現代陶芸の今に焦点を当てた本展では、陶芸部会所属作家を中心に、それ以外の作家の作品を含めた137名の作家による作品139点を展覧します。,
,松田,城崎マリンワールド,兵庫県,,,,,,
,松田,兵庫県立歴史博物館,兵庫県,開館40周年記念企画展「ひょうご五国のやきもの」,2023/9/23,2023/11/26,https://rekihaku.pref.hyogo.lg.jp/exhibition/14137/,ひょうご五国（摂津、播磨、但馬、丹波、淡路）の各地では古くから様々な陶磁器が焼かれ、その作品や技の一部は現在まで受け継がれてきました。これらについて当館のコレクションを中心に紹介します。各地の多彩なやきものや、それらを生み出した兵庫県各地の魅力に触れていただければ幸いです。,
,松田,姫路市立美術館,兵庫県,チームラボ 無限の連続の中の存在,2023/10/21,2024/1/21,https://www.city.himeji.lg.jp/art/0000024669.html,チームラボは、自分と世界とのあらゆる境界が取り払われた「ボーダレス」な世界に目を向け、アートによって人類の世界認識を変えようとしています。自分が立つ現実世界と、目の前に展開する作品世界の時空がつながるアート空間 ー超主観空間ー に“没入”する経験を通じて、鑑賞者はこの世界が連続性の上に成り立っていることを身体的に認識することができます。近年、チームラボの探求はさらに深化を遂げ、「生命とは何か」というテーマのもと、「私という存在は、心と体とそれらと連続する環境によって創られている」という考えを表す作品を次々発表しています。生物と無生物との境界をも超える認識へと鑑賞者を導くチームラボのアートの現在地を、前期・後期の展示替えを通して長大なスケールで展開します。,
,松田,姫路市立動物園,兵庫県,,,,,,
,松田,姫路文学館,兵庫県,司馬遼太郎生誕百年　企画展「小林修写真展　司馬遼太郎『街道をゆく』の視点　－歩いた風土、見抜いた時代－」,2023/10/7,2023/11/26,http://www.himejibungakukan.jp/events/event/kobayashiosamu2023/,司馬さんが伝えようとした言葉とシンクロする、普遍性を持った風景に出会う瞬間があるのだ。（小林修）小林修氏は「週刊朝日」で連載されていた「司馬遼太郎シリーズ」の写真を17年にわたり担当し、作家司馬遼太郎氏の作品世界を表現しつづけているカメラマンです。司馬氏のライフワーク『街道をゆく』の最後の担当であった村井重俊氏とともに司馬作品ゆかりの地を取材し、その原風景を撮りつづけてきました。本展は、小林氏が長年にわたり撮り重ねてきた膨大な写真群のなかから厳選した約百点を展示します。写真のテーマは『街道をゆく』をメインにすえて、同作において時空を自在に行き交い、時代をするどく見抜いた司馬氏の思索と密接なつながりをもつ『坂の上の雲』『竜馬がゆく』『播磨灘物語』などの小説、『この国のかたち』ほかのエッセイなどにも広がっています。東京六本木のフジフイルムスクエア、富士フイルムフォトサロン大阪の展覧会において展示した写真に、姫路文学館では播磨関連の写真を加えています。司馬作品の世界に共鳴する小林氏の写真の魅力をどうぞご堪能ください。,
,松田,姫路市立水族館,兵庫県,企画展「飼育係がとらえた！決定的瞬間！」,2023/10/28,2023/12/25,https://www.city.himeji.lg.jp/aqua/0000017317.html,令和5年10月28日（土曜日）から「飼育係がとらえた！決定的瞬間！」を開催いたします。主に当館で飼育している生きものの摂餌、休息、闘争、求愛、誕生、保護、変態など、生きもののさまざまな豊かな表情を、映像や写真などを通して紹介し、身近な生きものや自然の魅力を再発見していただくといった内容です。,
,小松原,太子町立歴史資料館,兵庫県,絵図から見る人々のくらし,2023/10/28,2023/12/17,https://www.town.hyogo-taishi.lg.jp/soshikikarasagasu/rekisisiryo/planningexhibition/1426576980734.html,太子ゆかりのまちで、ふるさとづくりに歴史的遺産を役立ててもらうために開館した歴史資料館は、令和5年に開館30周年を迎えます。この節目を記念して、太子町及びその周辺の土地の利用や用水の状況を描いた絵図を、新資料を含めて展示します。,
,小松原,姫路科学館,兵庫県,第59回 姫路市児童生徒科学作品展　調査研究の部,2023/10/28,2023/11/19,https://www.city.himeji.lg.jp/atom/tokuten/archive/23sakuhinten/index.html,姫路市や近隣町の小中学生が、夏休みにがんばって取り組んだ工作や自由研究を展示します。未来の科学者の作品を会場で見よう！,
,小松原,明石市立天文科学館,兵庫県,プラネタリウム展,2023/10/21,2023/12/3,https://www.am12.jp/tokuten/,,
,小松原,兵庫県立考古博物館,兵庫県,駅家発掘！－播磨から見えた古代日本の交通史－,2023/9/30,2023/12/3,https://www.hyogo-koukohaku.jp/modules/exhibition/index.php?action=PageView&page_id=82,"日本が本格的な国家建設に取りかかった1,300年前、奈良の都と九州の大宰府を結ぶ山陽道沿いには、行き交う使者が馬を乗り継ぐ「駅家」という施設が建設されました。播磨の駅家は遺跡から所在を推定できるものが多く、当館では開館以来継続的に発掘調査を実施しています。この全国最先端の調査研究により、文献に記された駅家の遺構が現地で次々と見つかるなど新たな発見がありました。本展では、県内および山陽道各地の調査事例をもとに、古代の交通インフラの実態を紹介します。",
,小松原,小野市立好古館,兵庫県,お堂の道具あれこれー小野市文化財悉皆調査速報展2ー,2023/10/7,2023/12/3,https://www.city.ono.hyogo.jp/soshikikarasagasu/kokokan/kaisaiitiran/tokubetuten/12007.html,令和3年度と4年度にかけて、市内の仏堂（仏像などを安置する村の建物）に保存されている文化財を全て調べました〈悉皆(しっかい)調査〉。そこで、数ある文化財の中から、お堂でむかしから使われてきた香時計や掛軸などを約25点紹介します。この機会に、わが町の歴史・文化を再発見してみませんか。,
,小松原,日本玩具博物館,兵庫県,世界のクリスマス＊喜びの造形,2023/11/11,2024/1/28,https://japan-toy-museum.org/archives/exhibition/special/%e3%80%8c%e4%b8%96%e7%95%8c%e3%81%ae%e3%82%af%e3%83%aa%e3%82%b9%e3%83%9e%e3%82%b9%ef%bc%8a%e5%96%9c%e3%81%b3%e3%81%ae%e9%80%a0%e5%bd%a2%e3%80%8d,恒例となった当館のクリスマス展は、クリスマス飾りを通して世界各地のクリスマス風景を描き、この行事の意味を探る試みです。本年は、世界55ヶ国のクリスマスに登場するオーナメントを、北ヨーロッパ、中央ヨーロッパ、東ヨーロッパ、南ヨーロッパ、北部アメリカ、中南部アメリカ、アジア、アフリカの8つの地域に分けて展示し、各地のクリスマス飾りの特徴を紹介します。本場ヨーロッパの伝統あるオーナメントはもちろんですが、今回は、メキシコやペルー、ブラジルなどラテンアメリカ諸国の民芸的なクリスマス造形がみどころです。新たな光を讃え、小さな生命の輝きを祝い喜ぶクリスマスーー世界各地の民族色豊かなクリスマス飾りを通して、クリスマス文化の奥行の深さを感じていだければと思います。,
,小松原,たつの市立龍野歴史文化資料館,兵庫県,街道の風景 ～宿場町に伝わったもの～,2023/10/21,2023/12/10,https://www.city.tatsuno.lg.jp/rekibun/2023kaidou.html,たつの市域を往来していた江戸時代の街道と宿場町の歴史について、街道絵図や宿場町に伝わった初公開や新発見の資料を通して紹介します。,
,大矢,公益財団法人名勝依水園・寧楽美術館,奈良県,やきもの用語実見展　虫喰い、口紅ってなんだろう??,2023/8/11,2023/12/24,https://isuien.or.jp/includes/set_exhibition_j.php,日本にはやきものを愛するがゆえに生み出された多くのやきもの用語が存在します。中にはユーモラスな表現のものも。本展では、やきものの製作技法や見どころに関する用語を、実際の事例とともに紹介します。やきもの鑑賞の楽しみがいっそう深まれば幸いです。,
,大矢,春日大社国宝殿,奈良県,夏・秋季特別展「人々の祈りを見守る 文様となった招福の動物や植物たち」,2023/7/8,2023/12/13,https://www.kasugataisha.or.jp/museum_exhibitions/12701/,春日大社に伝わる宝物は、神様がお持ちになり、御覧になる品々で、美しい文様で飾られています。祭礼で身に着ける装束や道具にも様々な文様が施され、その様子は絵画にも描かれています。いにしえの文様はただ美しいだけでなく、魔除けや吉祥の祈り等と深く結びついています。文様を通じて春日大社の文化や歴史を探り、楽しい文様の世界にご案内します。,
,大矢,春日大社万葉植物園,奈良県,,,,,,
,大矢,奈良県立美術館,奈良県,特別展　仮面芸能の系譜　仮面芸能のふるさと奈良,2023/9/30,2023/11/12,https://www.pref.nara.jp/63124.htm,わが国は、先史時代から仮面芸能が生きづく希有な文化を持っています。縄文時代の土面に始まり、飛鳥時代に百済人が伝えた伎楽や、大陸から伝来し平安時代に集大成された雅楽・舞楽。また曲芸的な散楽、水田耕作と密着した田楽。その淵源が謎に包まれた予祝舞・翁舞や、中世に大和国において猿楽から発展した能狂言へとつながります。本展では、仮面に加え、装束や楽器、映像、音源などを展覧し、奈良で生まれ育った仮面芸能の魅力をお伝えします。,
,大矢,奈良県立美術館,奈良県,特別展　漂泊の画家　不染鉄,2024/1/13,2024/3/10,https://www.pref.nara.jp/63125.htm,懐かしくも幻想的な独特の絵画世界を展開した不染鉄（ふせん・てつ　1891-1976）。東京で生まれ、伊豆大島から京都、そして奈良へと、あたかも安住の地を求めるかのように遍歴を重ね、次第に深まりを見せるその画境には、過去の思い出とともに静穏な日々の営みを慈しむ不染の理想郷的世界が投影されています。およそ5年ぶりとなる本回顧展では、初期から晩年までに代表作により、心に沁み入るような不染作品の魅力を改めて紹介いたします。,
,大矢,奈良国立博物館,奈良県,第75回　正倉院展,2023/10/28,2023/11/13,https://www.narahaku.go.jp/exhibition/special/special_exhibition/202310_shosoin/,正倉院宝物は、東大寺の重要な資財を保管する倉であった正倉院正倉に伝来した宝物群です。正倉院展では、およそ9000件にも上る正倉院宝物の中から毎年60件前後が公開されます。75回目の開催となる本年も、調度品、楽器、服飾品、仏具、文書といった正倉院宝物の全体像がうかがえるラインナップで、宝物の魅力を余すことなく伝えます。正倉院宝物の歴史は、天平勝宝8歳（756）6月21日、聖しょう武む天てん皇のうの四十九日である七七忌に際して光こう明みょう皇こう后ごうが天皇遺愛の品を大仏に献納したことにはじまります。献納された品々は、そのときに作成された献納品のリスト『国こっ家か珍ちん宝ぽう帳ちょう』に記載され、正倉院宝物の中核に位置付けられています。本年はその中から、『国家珍宝帳』の筆頭に記載される「九く条じょう刺し納のう樹じゅ皮ひ色しょくの袈け裟さ」（刺し子縫いの袈裟）をはじめ、「漫まん背ぱいの八はっ角かく鏡きょう」（無地の花形鏡）や「鳥とり草くさ夾きょう纈けちの屛びょう風ぶ」（板じめ染めの屛風）などが出陳されます。中でも袈裟は、聖武天皇の仏教への篤い信仰を象徴する品として、正倉院宝物を代表する屈指の名宝です。正倉院には、奈良時代に宮廷や寺院内で使われた楽器や調度品のほか、貴人たちのアクセサリーなども伝わっています。「楓かえで蘇す芳おう染ぞめ螺ら鈿でんの槽そうの琵び琶わ」（螺鈿飾りの四絃琵琶）は、槽に施されたきらびやかな螺鈿の装飾が目を惹く一方、撥ばち受うけには中国・盛唐期の画風にもとづく山水画が描かれ、奈良時代の異国趣味を濃厚に示しています。「平へい螺ら鈿でん背はいの円えん鏡きょう」（螺鈿飾りの鏡）や「銀ぎん平へい脱だつの鏡かがみ箱ばこ」（鏡の箱）、「斑はん犀さいの把つか漆うるしの鞘さや黄おう金ごん葛かずら形がた珠しゅ玉ぎょく荘かざりの刀とう子す」（腰帯から下げた小刀）といった品々にも、螺鈿・金銀・珠玉類など高級な素材が惜しげもなく使われています。これらの宝物を通して、奈良時代の貴人たちの異国情緒あふれる華やかな暮らしぶりが垣間見られます。東大寺など大寺院を飾った多彩な仏具類も見逃せません。「碧へき地じ金きん銀ぎん絵えの箱はこ」（花鳥文様の脚付き箱）は明るい青の色彩が目にも鮮やかな品ですが、一方で「刻こく彫ちょう梧ご桐とう金きん銀ぎん絵えの花はな形がた合ごう子す」（花形のふたもの）といった花葉の生き生きとした彫刻に目を見張る品もあり、正倉院の仏具の多様な装飾表現をご覧いただくことができます。また、東大寺初代別べっ当とうをつとめた良ろう弁べん（689～773）の1250年御遠忌にあたる本年、良弁自ら署名した文書を含む「正しょう倉そう院いん古こ文もん書じょ正せい集しゅう　第七巻」（少しょう僧そう都ず良ろう弁べん牒ちょうほか）が出陳されることも注目されます。そのほか、道教思想にもとづく仙薬せんやくの容器ともいわれる「青せい斑はん石せきの鼈べつ合ごう子す」（スッポン形のふたもの）などを通じ、奈良時代の信仰世界の奥行きと広がりにも触れていただけます。正倉院では、長い歴史の中で残片となったものも大切に守り継がれてきました。正倉院事務所による最新の研究成果では、「漆うるし六ろっ角かくの厨ず子し残ざん欠けつ」（厨子の部材）のそれぞれのパーツの特定が試みられ、長六角形の平面をもつ奈良時代の厨子の当初の姿が浮かび上がってきました。本年は、こうした厨子や正倉院の塵じん芥かい文もん書じょの復元研究の成果を通し、宝物が織り成す歴史のロマンを体感していただきたいと思います。,
,大矢,奈良国立博物館,奈良県,おん祭と春日信仰の美術,2023/12/9,2024/1/14,https://www.narahaku.go.jp/exhibition/special/feature_exhibition/202312_on-matsuri/,平安時代以来、脈々と続く春日若宮の祭礼「おん祭」の時期にあわせ、おん祭及び春日信仰に関連する絵画・文書・工芸品などを展示します。,
,大矢,奈良国立博物館,奈良県,新たに修理された文化財,2023/12/19,2024/1/14,https://www.narahaku.go.jp/exhibition/special/thematic_exhibition/202312_shuri/,近年当館が実施した修理事業で修理した作品を展示し、修理内容をパネルでご紹介します。,
,大矢,奈良国立博物館,奈良県,お水取り,2024/2/10,2024/3/17,https://www.narahaku.go.jp/exhibition/special/feature_exhibition/202402_omizutori/,奈良時代から一度の中断もなく続く東大寺二月堂の「お水取り」。本展では、「お水取り」や二月堂にまつわる絵画、工芸品、典籍等を展示し、その歴史と信仰を紹介します。,
,大矢,奈良国立博物館,奈良県,空海　KŪKAI ―密教のルーツとマンダラ世界,2024/4/13,2024/6/9,https://www.narahaku.go.jp/exhibition/special/special_exhibition/202404_kukai/,"空海の生誕1250年を記念して、奈良国立博物館の総力を挙げた展覧会を開催します。「虚空尽き、衆生尽き、涅槃尽きなば、わが願いも尽きむ。」（『性霊集』巻第八）空海が人々を救うためにたどり着いたのは密教でした。本展では、空海がもたらした密教の国際的なルーツを辿るとともに、空海が伝えたマンダラの世界を展示室に展開し、その偉業を顕彰します。　
（この世の全ての物が消滅し、仏法の世界が尽きるまで、私は人々が救われることを願い続ける）",
,大矢,公益財団法人松伯美術館,奈良県,文化勲章受章・卒寿記念特別展 上村淳之展,2023/10/14,2023/12/24,https://www.kintetsu-g-hd.co.jp/culture/shohaku/exhibition/exhibition.html,令和５年、当館の館長・上村淳之は卒寿を迎えます。淳之は、幼いころから、父 松篁が飼っていた小鳥たちとふれあい、美大三年生までの課題制作をおえると、専ら花鳥画を描くようになります。「鳥が好きだからテーマになり、テーマになるから鳥の数も増えてゆく」と述べるように、「唳禽荘」（自宅・アトリエ）で多くの鳥と共に暮らし、絵筆を握ってきました。その業績により、平成25年（2013）に文化功労者となり、令和４年（2022）文化勲章を受章しました。 東洋的感性の減退や現代の日本画について真摯に警告を発し、さまざまな鳥の姿を通じて、自然の叡智を示し、未来へのメッセージを送り続ける上村淳之の姿を紹介します。,
,大矢,公益財団法人松伯美術館,奈良県,企画展　未来につなぐ日本画展 －松伯美術館公募展優秀賞受賞作家の現在Ⅱ－,2024/1/15,2024/2/17,https://www.kintetsu-g-hd.co.jp/culture/shohaku/exhibition/exhibition.html,昨年度の松伯美術館公募展優秀賞受賞作家の第２回目として、１９９３年の開館以来、毎年、開催してきた公募展の歴代優秀賞受賞作家の現在の作品をご紹介します。日本画を模索する作家達の育成と伸長を企図した公募展の歩みを振り返る機会として、優秀賞受賞作家の皆さまに現在の作品を自由に発表していただきます。豊かな感性で描かれた多様な表現の作品一点一点をご高覧いただき、本展が環境や価値観の激しい変化の中で日本画の未来について問いかける貴重な機会となるよう願っています。,
,大矢,公益財団法人中野美術館,奈良県,松本竣介、駒井哲郎から舟越桂まで－戦後日本の洋画・版画－〈洋画展示室〉,2023/9/9,2023/11/12,http://www.nakano-museum.jp/exhibition/index.html,この展覧会は、洋画では第二次世界大戦の最中にアメリカで描かれた国吉康雄の作品や終戦直後の東京を描いた松本竣介の油彩《焼跡風景》(1946年)をはじめ、須田国太郎、鳥海青児、林武などの作品を中心に、版画では、戦後日本人作家が海外で受賞を重ね評価が高まる中、サンパウロビエンナーレで受賞した駒井哲郎の出世作《束の間の幻影》(1951年)やパリに生きた長谷川潔のマニエール・ノワールの代表作から舟越桂のリトグラフ《影のある光》(1993年)まで、洋画、版画併せて約30点を展示いたします。 本展は、戦後から現代まで国際的な美術の動向の中で、日本の洋画・版画がどのように展開していったかを中野美術館のコレクションで辿ります。,
,大矢,公益財団法人中野美術館,奈良県,近代の日本画〈日本画展示室〉,2023/9/10,2023/11/13,http://www.nakano-museum.jp/exhibition/index.html,富岡鉄斎、横山大観、竹内栖鳳、入江波光、村上華岳、冨田溪仙などの近代の日本画27点を展示いたします。,
,大矢,公益財団法人大和文華館,奈良県,特別展　いぬねこ彩彩　―東アジアの犬と猫の絵画―,2023/10/7,2023/11/12,https://www.kintetsu-g-hd.co.jp/culture/yamato/exhibition/inunekosaisai.html,人間にとって親しみ深い動物である犬と猫は、東アジアでは古くから絵画のモチーフとしても人気を博しました。それらは、必ずしも心を憩わせる愛らしい姿のみを求められて生まれたのではなく、日々の幸福への祈り、異国への憧れ、権威の象徴、社会風刺などといった、人間の様々な思いを託されることで、しばしば描かれてきたのです。本展観では、中国、朝鮮半島、日本における、12～20世紀に制作された犬図・猫図を通して、東アジアにおける多彩な動物画の一様相をご覧いただきます。各地域の歴史・文化のもとで育まれた犬と猫のモチーフは、それぞれが独特な趣を備えています。しかしながら、それらを一堂に集めたとき、個々のモチーフや表現などに共通するものがあると気づかされます。それらは、東アジアにおける文物の受容史を物語るとともに、先述したような様々な背景のもと、時に選択的に用いられました。また犬と猫をより活き活きと、魅力的に表したいという画家の創意工夫、あるいはそれを求める鑑賞者の声などにも答えながら、発展していったと考えられるのです。重要文化財5件、重要美術品1件を含む、計63件の犬と猫にまつわる絵画作品を通して、東アジアで花開いた豊かな動物画の世界を、どうぞお楽しみください。,
,大矢,公益財団法人大和文華館,奈良県,特別企画展　朝鮮螺鈿の美,2023/11/17,2023/12/24,https://www.kintetsu-g-hd.co.jp/culture/yamato/exhibition/,貝殻を用いて文様をあらわす螺鈿漆器は、朝鮮半島で盛んに制作されました。貝のやわらかな光彩により､巧みにあらわされた文様の美しさをお楽しみ下さい。,
,大矢,公益財団法人大和文華館,奈良県,特別企画展　やまと絵のこころ,2024/1/5,2024/2/18,https://www.kintetsu-g-hd.co.jp/culture/yamato/exhibition/,四季の景物を描いた平安時代の絵画に端を発するやまと絵。その美意識を受け継いだ江戸時代の琳派や復古やまと絵派まで、多様に展開したやまと絵の精髄を探ります。,
